[
  {"user_id": "demo_user", "transaction_date": "2026-05-01", "amount": 6000.0, "description": "EMPLOYER PAYROLL DIRECT DEP", "raw_category": "Income", "normalized_category": "income"},
  {"user_id": "demo_user", "transaction_date": "2026-05-02", "amount": -2000.0, "description": "MAIN STREET APARTMENTS RENT", "raw_category": "Mortgage & Rent", "normalized_category": "housing"},
  {"user_id": "demo_user", "transaction_date": "2026-05-05", "amount": -150.0, "description": "CITY POWER & WATER", "raw_category": "Utilities", "normalized_category": "utilities"},
  {"user_id": "demo_user", "transaction_date": "2026-05-08", "amount": -245.5, "description": "WHOLE FOODS MARKET #102", "raw_category": "Groceries", "normalized_category": "groceries"},
  {"user_id": "demo_user", "transaction_date": "2026-05-12", "amount": -15.0, "description": "NETFLIX.COM STREAMING", "raw_category": "Entertainment", "normalized_category": "subscriptions"},
  {"user_id": "demo_user", "transaction_date": "2026-05-15", "amount": -95.0, "description": "TRADER JOE'S #44", "raw_category": "Groceries", "normalized_category": "groceries"},
  {"user_id": "demo_user", "transaction_date": "2026-05-18", "amount": -110.0, "description": "OSTERIA LA BUCA DINING", "raw_category": "Food & Drink", "normalized_category": "dining"},
  {"user_id": "demo_user", "transaction_date": "2026-05-22", "amount": -190.0, "description": "SUSHI GEN RESTAURANT", "raw_category": "Food & Drink", "normalized_category": "dining"},
  {"user_id": "demo_user", "transaction_date": "2026-05-28", "amount": -160.0, "description": "SAFEWAY STORE #882", "raw_category": "Groceries", "normalized_category": "groceries"},
  {"user_id": "demo_user", "transaction_date": "2026-06-01", "amount": 6000.0, "description": "EMPLOYER PAYROLL DIRECT DEP", "raw_category": "Income", "normalized_category": "income"},
  {"user_id": "demo_user", "transaction_date": "2026-06-02", "amount": -2000.0, "description": "MAIN STREET APARTMENTS RENT", "raw_category": "Mortgage & Rent", "normalized_category": "housing"},
  {"user_id": "demo_user", "transaction_date": "2026-06-05", "amount": -150.0, "description": "CITY POWER & WATER", "raw_category": "Utilities", "normalized_category": "utilities"},
  {"user_id": "demo_user", "transaction_date": "2026-06-09", "amount": -260.0, "description": "WHOLE FOODS MARKET #102", "raw_category": "Groceries", "normalized_category": "groceries"},
  {"user_id": "demo_user", "transaction_date": "2026-06-12", "amount": -15.0, "description": "NETFLIX.COM STREAMING", "raw_category": "Entertainment", "normalized_category": "subscriptions"},
  {"user_id": "demo_user", "transaction_date": "2026-06-15", "amount": -120.0, "description": "TRADER JOE'S #44", "raw_category": "Groceries", "normalized_category": "groceries"},
  {"user_id": "demo_user", "transaction_date": "2026-06-19", "amount": -140.0, "description": "BESTIA DINING", "raw_category": "Food & Drink", "normalized_category": "dining"},
  {"user_id": "demo_user", "transaction_date": "2026-06-25", "amount": -160.0, "description": "REPUBLIC RESTAURANT", "raw_category": "Food & Drink", "normalized_category": "dining"},
  {"user_id": "demo_user", "transaction_date": "2026-06-29", "amount": -120.0, "description": "SAFEWAY STORE #882", "raw_category": "Groceries", "normalized_category": "groceries"},
  {"user_id": "demo_user", "transaction_date": "2026-07-01", "amount": 6000.0, "description": "EMPLOYER PAYROLL DIRECT DEP", "raw_category": "Income", "normalized_category": "income"},
  {"user_id": "demo_user", "transaction_date": "2026-07-02", "amount": -2000.0, "description": "MAIN STREET APARTMENTS RENT", "raw_category": "Mortgage & Rent", "normalized_category": "housing"},
  {"user_id": "demo_user", "transaction_date": "2026-07-05", "amount": -150.0, "description": "CITY POWER & WATER", "raw_category": "Utilities", "normalized_category": "utilities"},
  {"user_id": "demo_user", "transaction_date": "2026-07-08", "amount": -250.0, "description": "WHOLE FOODS MARKET #102", "raw_category": "Groceries", "normalized_category": "groceries"},
  {"user_id": "demo_user", "transaction_date": "2026-07-12", "amount": -15.0, "description": "NETFLIX.COM STREAMING", "raw_category": "Entertainment", "normalized_category": "subscriptions"},
  {"user_id": "demo_user", "transaction_date": "2026-07-16", "amount": -100.0, "description": "TRADER JOE'S #44", "raw_category": "Groceries", "normalized_category": "groceries"},
  {"user_id": "demo_user", "transaction_date": "2026-07-20", "amount": -150.0, "description": "NOBU RESTAURANT", "raw_category": "Food & Drink", "normalized_category": "dining"},
  {"user_id": "demo_user", "transaction_date": "2026-07-24", "amount": -150.0, "description": "FELIX TRATTORIA", "raw_category": "Food & Drink", "normalized_category": "dining"},
  {"user_id": "demo_user", "transaction_date": "2026-07-29", "amount": -150.0, "description": "SAFEWAY STORE #882", "raw_category": "Groceries", "normalized_category": "groceries"},
  {"user_id": "demo_user", "transaction_date": "2026-08-01", "amount": 6000.0, "description": "EMPLOYER PAYROLL DIRECT DEP", "raw_category": "Income", "normalized_category": "income"},
  {"user_id": "demo_user", "transaction_date": "2026-08-02", "amount": -2000.0, "description": "MAIN STREET APARTMENTS RENT", "raw_category": "Mortgage & Rent", "normalized_category": "housing"},
  {"user_id": "demo_user", "transaction_date": "2026-08-05", "amount": -150.0, "description": "CITY POWER & WATER", "raw_category": "Utilities", "normalized_category": "utilities"},
  {"user_id": "demo_user", "transaction_date": "2026-08-08", "amount": -255.0, "description": "WHOLE FOODS MARKET #102", "raw_category": "Groceries", "normalized_category": "groceries"},
  {"user_id": "demo_user", "transaction_date": "2026-08-11", "amount": -35.0, "description": "SPOTIFY + NETFLIX BUNDLE", "raw_category": "Entertainment", "normalized_category": "subscriptions"},
  {"user_id": "demo_user", "transaction_date": "2026-08-14", "amount": -100.0, "description": "TRADER JOE'S #44", "raw_category": "Groceries", "normalized_category": "groceries"},
  {"user_id": "demo_user", "transaction_date": "2026-08-17", "amount": -320.0, "description": "FRENCH LAUNDRY DINING", "raw_category": "Food & Drink", "normalized_category": "dining"},
  {"user_id": "demo_user", "transaction_date": "2026-08-21", "amount": -330.0, "description": "PROVIDENCE RESTAURANT", "raw_category": "Food & Drink", "normalized_category": "dining"},
  {"user_id": "demo_user", "transaction_date": "2026-08-28", "amount": -145.0, "description": "SAFEWAY STORE #882", "raw_category": "Groceries", "normalized_category": "groceries"}
]
